{
  "schema_version": "1.0",
  "source_file": "inventory_orders_sample.xlsm",
  "modules": [
    {
      "name": "modInventory",
      "type": "standard",
      "stream": "VBA/modInventory",
      "line_count": 164,
      "code": "Attribute VB_Name = \"modInventory\"\nOption Explicit\n\nPublic Const LOW_STOCK_LABEL As String = \"Low\"\nPublic Const OK_STOCK_LABEL As String = \"OK\"\n\n' Adds a new product at the end of the Products sheet.\nPublic Sub AddProduct(ByVal sku As String, ByVal productName As String, ByVal category As String, ByVal unitPrice As Double, ByVal stock As Long, ByVal reorderLevel As Long)\n    Dim ws As Worksheet\n    Dim nextRow As Long\n    Set ws = ThisWorkbook.Worksheets(\"Products\")\n    If FindProductRow(sku) > 0 Then\n        MsgBox \"Product \" & sku & \" already exists.\"\n        Exit Sub\n    End If\n    nextRow = ws.Cells(ws.Rows.Count, 1).End(xlUp).row + 1\n    ws.Cells(nextRow, 1).Value = UCase(sku)\n    ws.Cells(nextRow, 2).Value = productName\n    ws.Cells(nextRow, 3).Value = category\n    ws.Cells(nextRow, 4).Value = unitPrice\n    ws.Cells(nextRow, 5).Value = stock\n    ws.Cells(nextRow, 6).Value = reorderLevel\nEnd Sub\n\n' Returns the row of a SKU on the Products sheet, or 0 when it is not found.\nPublic Function FindProductRow(ByVal sku As String) As Long\n    Dim found As Range\n    Set found = ThisWorkbook.Worksheets(\"Products\").Columns(1).Find(What:=sku, LookAt:=xlWhole)\n    If found Is Nothing Then\n        FindProductRow = 0\n    Else\n        FindProductRow = found.row\n    End If\nEnd Function\n\nPublic Function LookupPrice(ByVal sku As String) As Double\n    Dim r As Long\n    r = FindProductRow(sku)\n    If r = 0 Then\n        LookupPrice = 0\n    Else\n        LookupPrice = ThisWorkbook.Worksheets(\"Products\").Cells(r, 4).Value\n    End If\nEnd Function\n\n' Discount percentage by quantity ordered.\nPublic Function GetDiscount(ByVal qty As Long) As Double\n    Select Case qty\n        Case Is >= 100\n            GetDiscount = 0.15\n        Case Is >= 50\n            GetDiscount = 0.1\n        Case Is >= 10\n            GetDiscount = 0.05\n        Case Else\n            GetDiscount = 0\n    End Select\nEnd Function\n\nPublic Function CalcOrderTotal(ByVal unitPrice As Double, ByVal qty As Long) As Double\n    Dim gross As Double\n    gross = unitPrice * qty\n    CalcOrderTotal = Round(gross * (1 - GetDiscount(qty)), 2)\nEnd Function\n\n' Places an order: checks stock, writes the order row, reduces stock.\nPublic Function PlaceOrder(ByVal sku As String, ByVal qty As Long) As Boolean\n    Dim products As Worksheet\n    Dim orders As Worksheet\n    Dim prodRow As Long\n    Dim orderRow As Long\n    Set products = ThisWorkbook.Worksheets(\"Products\")\n    Set orders = ThisWorkbook.Worksheets(\"Orders\")\n    If Not IsValidQty(qty) Then\n        MsgBox \"Quantity must be between 1 and 1000.\"\n        PlaceOrder = False\n        Exit Function\n    End If\n    prodRow = FindProductRow(sku)\n    If prodRow = 0 Then\n        MsgBox \"Unknown product: \" & sku\n        PlaceOrder = False\n        Exit Function\n    End If\n    If products.Cells(prodRow, 5).Value < qty Then\n        MsgBox \"Not enough stock for \" & sku\n        PlaceOrder = False\n        Exit Function\n    End If\n    orderRow = orders.Cells(orders.Rows.Count, 1).End(xlUp).row + 1\n    orders.Cells(orderRow, 1).Value = \"ORD-\" & Format(orderRow - 1, \"0000\")\n    orders.Cells(orderRow, 2).Value = Date\n    orders.Cells(orderRow, 3).Value = sku\n    orders.Cells(orderRow, 4).Value = qty\n    orders.Cells(orderRow, 5).Value = CalcOrderTotal(products.Cells(prodRow, 4).Value, qty)\n    orders.Cells(orderRow, 6).Value = \"Open\"\n    products.Cells(prodRow, 5).Value = products.Cells(prodRow, 5).Value - qty\n    CheckReorder sku\n    PlaceOrder = True\nEnd Function\n\nPublic Sub CheckReorder(ByVal sku As String)\n    Dim r As Long\n    Dim ws As Worksheet\n    Set ws = ThisWorkbook.Worksheets(\"Products\")\n    r = FindProductRow(sku)\n    If r = 0 Then Exit Sub\n    If ws.Cells(r, 5).Value <= ws.Cells(r, 6).Value Then\n        MsgBox \"Stock for \" & ws.Cells(r, 2).Value & \" is low. Please reorder.\"\n    End If\nEnd Sub\n\n' Marks each product as Low or OK.\nPublic Sub RefreshStockStatus()\n    Dim ws As Worksheet\n    Dim lastRow As Long\n    Dim i As Long\n    Set ws = ThisWorkbook.Worksheets(\"Products\")\n    lastRow = ws.Cells(ws.Rows.Count, 1).End(xlUp).row\n    For i = 2 To lastRow\n        If ws.Cells(i, 5).Value <= ws.Cells(i, 6).Value Then\n            ws.Cells(i, 7).Value = LOW_STOCK_LABEL\n        Else\n            ws.Cells(i, 7).Value = OK_STOCK_LABEL\n        End If\n    Next i\nEnd Sub\n\n' Writes the low-stock products to a CSV file.\nPublic Sub ExportLowStockCSV()\n    Dim ws As Worksheet\n    Dim lastRow As Long\n    Dim i As Long\n    Dim filePath As String\n    Dim fileNum As Integer\n    Set ws = ThisWorkbook.Worksheets(\"Products\")\n    lastRow = ws.Cells(ws.Rows.Count, 1).End(xlUp).row\n    filePath = ThisWorkbook.Path & Application.PathSeparator & \"low_stock.csv\"\n    fileNum = FreeFile\n    Open filePath For Output As #fileNum\n    Print #fileNum, \"SKU,Name,Stock,ReorderLevel\"\n    For i = 2 To lastRow\n        If ws.Cells(i, 7).Value = LOW_STOCK_LABEL Then\n            Print #fileNum, ws.Cells(i, 1).Value & \",\" & ws.Cells(i, 2).Value & \",\" & ws.Cells(i, 5).Value & \",\" & ws.Cells(i, 6).Value\n        End If\n    Next i\n    Close #fileNum\n    MsgBox \"Exported to \" & filePath\nEnd Sub\n\nPublic Sub ExportOrdersPDF()\n    ThisWorkbook.Worksheets(\"Orders\").ExportAsFixedFormat Type:=xlTypePDF, Filename:=ThisWorkbook.Path & \"\\orders.pdf\"\nEnd Sub\n\nPublic Sub EmailLowStockReport()\n    Dim outlookApp As Object\n    Dim mail As Object\n    Set outlookApp = CreateObject(\"Outlook.Application\")\n    Set mail = outlookApp.CreateItem(0)\n    mail.To = \"purchasing@example.com\"\n    mail.Subject = \"Low stock report\"\n    mail.Body = \"See the attached low stock list.\"\n    mail.Send\nEnd Sub"
    },
    {
      "name": "modUtils",
      "type": "standard",
      "stream": "VBA/modUtils",
      "line_count": 16,
      "code": "Attribute VB_Name = \"modUtils\"\nOption Explicit\n\nPrivate Declare PtrSafe Sub Sleep Lib \"kernel32\" (ByVal dwMilliseconds As Long)\n\nPublic Function FormatSku(ByVal text As String) As String\n    FormatSku = UCase(Trim(text))\nEnd Function\n\nPublic Function IsValidQty(ByVal qty As Long) As Boolean\n    IsValidQty = (qty >= 1 And qty <= 1000)\nEnd Function\n\nPublic Sub PauseBriefly()\n    Sleep 500\nEnd Sub"
    },
    {
      "name": "clsProduct",
      "type": "standard",
      "stream": "VBA/clsProduct",
      "line_count": 31,
      "code": "Attribute VB_Name = \"clsProduct\"\nOption Explicit\n\nPrivate pSku As String\nPrivate pName As String\nPrivate pStock As Long\nPrivate pReorderLevel As Long\n\nPublic Property Get Sku() As String\n    Sku = pSku\nEnd Property\n\nPublic Property Let Sku(ByVal value As String)\n    pSku = value\nEnd Property\n\nPublic Property Get Stock() As Long\n    Stock = pStock\nEnd Property\n\nPublic Property Let Stock(ByVal value As Long)\n    pStock = value\nEnd Property\n\nPublic Property Let ReorderLevel(ByVal value As Long)\n    pReorderLevel = value\nEnd Property\n\nPublic Function IsLowStock() As Boolean\n    IsLowStock = (pStock <= pReorderLevel)\nEnd Function"
    },
    {
      "name": "ThisWorkbook",
      "type": "sheet",
      "stream": "VBA/ThisWorkbook",
      "line_count": 28,
      "code": "Attribute VB_Name = \"ThisWorkbook\"\nAttribute VB_Base = \"0{00020820-0000-0000-C000-000000000046}\"\nAttribute VB_GlobalNameSpace = False\nAttribute VB_Creatable = False\nAttribute VB_PredeclaredId = True\nAttribute VB_Exposed = True\nAttribute VB_TemplateDerived = False\nAttribute VB_Customizable = True\nOption Explicit\n\nPrivate Sub Workbook_Open()\n    Application.ScreenUpdating = False\n    RefreshStockStatus\n    Application.ScreenUpdating = True\nEnd Sub\n\nPrivate Sub Workbook_SheetChange(ByVal Sh As Object, ByVal Target As Range)\n    ' When a quantity on the Orders sheet changes, recalculate that order's total\n    If Sh.Name <> \"Orders\" Then Exit Sub\n    If Target.Column <> 4 Then Exit Sub\n    Application.EnableEvents = False\n    Dim unitPrice As Double\n    Dim rowNum As Long\n    rowNum = Target.Row\n    unitPrice = LookupPrice(Sh.Cells(rowNum, 3).Value)\n    Sh.Cells(rowNum, 5).Value = CalcOrderTotal(unitPrice, CLng(Target.Value))\n    Application.EnableEvents = True\nEnd Sub"
    }
  ],
  "findings": [
    {
      "type": "AutoExec",
      "keyword": "Workbook_Open",
      "description": "Runs when the Excel Workbook is opened"
    },
    {
      "type": "Suspicious",
      "keyword": "Open",
      "description": "May open a file"
    },
    {
      "type": "Suspicious",
      "keyword": "Output",
      "description": "May write to a file (if combined with Open)"
    },
    {
      "type": "Suspicious",
      "keyword": "Print #",
      "description": "May write to a file (if combined with Open)"
    },
    {
      "type": "Suspicious",
      "keyword": "CreateObject",
      "description": "May create an OLE object"
    },
    {
      "type": "Suspicious",
      "keyword": "Lib",
      "description": "May run code from a DLL"
    },
    {
      "type": "Suspicious",
      "keyword": "Hex Strings",
      "description": "Hex-encoded strings were detected, may be used to obfuscate strings (option --decode to see all)"
    },
    {
      "type": "Suspicious",
      "keyword": "Base64 Strings",
      "description": "Base64-encoded strings were detected, may be used to obfuscate strings (option --decode to see all)"
    }
  ],
  "flags": []
}